{
  "version": "1.0",
  "description": "Output: the candidate may be stricter than the target; extra candidate properties are fine while the target stays open.",
  "mode": "subsume",
  "options": {
    "profile": "OB-2020-12"
  },
  "left": {
    "openbindings": "0.2.0",
    "operations": {
      "identicalObjects": {
        "output": {
          "type": "object",
          "properties": {
            "id": {
              "type": "string"
            }
          },
          "required": [
            "id"
          ]
        }
      },
      "bothClosed": {
        "output": {
          "type": "object",
          "properties": {
            "id": {
              "type": "string"
            }
          },
          "additionalProperties": false
        }
      },
      "additionalPropsSchemaEqual": {
        "output": {
          "type": "object",
          "additionalProperties": {
            "type": "string"
          }
        }
      },
      "candidateClosesSchemaTarget": {
        "output": {
          "type": "object",
          "additionalProperties": {
            "type": "string"
          }
        }
      },
      "candidateAddsOptionalOpenTarget": {
        "output": {
          "type": "object",
          "properties": {
            "id": {
              "type": "string"
            }
          }
        }
      }
    }
  },
  "right": {
    "openbindings": "0.2.0",
    "operations": {
      "identicalObjects": {
        "output": {
          "type": "object",
          "properties": {
            "id": {
              "type": "string"
            }
          },
          "required": [
            "id"
          ]
        }
      },
      "bothClosed": {
        "output": {
          "type": "object",
          "properties": {
            "id": {
              "type": "string"
            }
          },
          "additionalProperties": false
        }
      },
      "additionalPropsSchemaEqual": {
        "output": {
          "type": "object",
          "additionalProperties": {
            "type": "string"
          }
        }
      },
      "candidateClosesSchemaTarget": {
        "output": {
          "type": "object",
          "additionalProperties": false
        }
      },
      "candidateAddsOptionalOpenTarget": {
        "output": {
          "type": "object",
          "properties": {
            "id": {
              "type": "string"
            },
            "extra": {
              "type": "string"
            }
          }
        }
      }
    }
  },
  "expected": {
    "summary": {
      "verdict": "compatible"
    }
  }
}
