{
  "version": "1.0",
  "description": "Output: candidate items wider than the target's \u2014 or absent while the target constrains elements \u2014 are breaking.",
  "mode": "subsume",
  "options": {
    "profile": "OB-2020-12"
  },
  "left": {
    "openbindings": "0.2.0",
    "operations": {
      "widerCandidateItems": {
        "output": {
          "type": "array",
          "items": {
            "type": "string"
          }
        }
      },
      "absentCandidateItems": {
        "output": {
          "type": "array",
          "items": {
            "type": "string"
          }
        }
      }
    }
  },
  "right": {
    "openbindings": "0.2.0",
    "operations": {
      "widerCandidateItems": {
        "output": {
          "type": "array",
          "items": {
            "type": [
              "string",
              "number"
            ]
          }
        }
      },
      "absentCandidateItems": {
        "output": {
          "type": "array"
        }
      }
    }
  },
  "expected": {
    "summary": {
      "verdict": "incompatible"
    }
  }
}
