{
  "version": "1.0",
  "description": "x- extension keys are stripped during normalization and never affect the verdict.",
  "mode": "subsume",
  "options": {
    "profile": "OB-2020-12"
  },
  "left": {
    "openbindings": "0.2.0",
    "operations": {
      "vendorExtensions": {
        "input": {
          "type": "string",
          "x-ob-hint": "a"
        }
      }
    }
  },
  "right": {
    "openbindings": "0.2.0",
    "operations": {
      "vendorExtensions": {
        "input": {
          "type": "string",
          "x-other": {
            "nested": true
          }
        }
      }
    }
  },
  "expected": {
    "summary": {
      "verdict": "compatible"
    }
  }
}
