{
  "version": "1.0",
  "description": "Input: a candidate that cannot cover every target variant \u2014 or is not a union when the target is \u2014 is breaking (no cross-form rule is defined).",
  "mode": "subsume",
  "options": {
    "profile": "OB-2020-12"
  },
  "left": {
    "openbindings": "0.2.0",
    "operations": {
      "candidateSubsetVariants": {
        "input": {
          "anyOf": [
            {
              "type": "string"
            },
            {
              "type": "number"
            }
          ]
        }
      },
      "candidateNotUnion": {
        "input": {
          "oneOf": [
            {
              "type": "string"
            },
            {
              "type": "number"
            }
          ]
        }
      }
    }
  },
  "right": {
    "openbindings": "0.2.0",
    "operations": {
      "candidateSubsetVariants": {
        "input": {
          "anyOf": [
            {
              "type": "string"
            }
          ]
        }
      },
      "candidateNotUnion": {
        "input": {
          "minLength": 1
        }
      }
    }
  },
  "expected": {
    "summary": {
      "verdict": "incompatible"
    }
  }
}
